{
  "published_at": "2026-10-16T12:54:25Z",
  "as_of": "2026-01-01",
  "base_date": "2025-01-01",
  "national": {
    "wage": 1634.0,
    "wage_yoy_pct": 4.4,
    "emp": 8113824,
    "emp_yoy_pct": 1.0,
    "as_of": "2026-01-01"
  },
  "markets": [
    {
      "key": "nova",
      "name": "Northern Virginia",
      "state": "VA",
      "iso": "PJM",
      "grid": null,
      "utility": "Dominion Energy Virginia",
      "note": "Loudoun + Prince William; Ashburn / Data Center Alley",
      "counties_total": 2,
      "counties_used": 2,
      "counties_suppressed": [],
      "as_of": "2026-01-01",
      "base_date": "2025-01-01",
      "yoy_basis": "like_for_like",
      "available": true,
      "thin_base": false,
      "wage": 1851.88,
      "wage_yoy_pct": 7.2,
      "wage_spread_pp": 2.8,
      "emp": 44761,
      "emp_yoy_pct": 15.4,
      "emp_spread_pp": 14.4,
      "wage_cur": 1851.88,
      "emp_cur_total": 44761,
      "counties": [
        {
          "fips": "51107",
          "wage": 2075.0,
          "emp": 27064,
          "wage_yoy_pct": 9.6,
          "emp_yoy_pct": 17.9
        },
        {
          "fips": "51153",
          "wage": 1514.0,
          "emp": 17697,
          "wage_yoy_pct": 1.8,
          "emp_yoy_pct": 11.8
        }
      ],
      "elec": {
        "as_of": "2026-01-01",
        "base_date": "2025-01-01",
        "available": true,
        "yoy_basis": "like_for_like",
        "wage": 2336.38,
        "wage_yoy_pct": 6.9,
        "wage_spread_pp": 0.2,
        "emp": 14731,
        "emp_yoy_pct": 36.0,
        "emp_spread_pp": 29.6,
        "wage_cur": 2336.38,
        "emp_cur_total": 14731,
        "counties_total": 2,
        "counties_used": 2,
        "counties_suppressed": [],
        "counties": [
          {
            "fips": "51107",
            "wage": 2392.0,
            "emp": 13638,
            "wage_yoy_pct": 7.8,
            "emp_yoy_pct": 37.3
          },
          {
            "fips": "51153",
            "wage": 1663.0,
            "emp": 1093,
            "wage_yoy_pct": -9.0,
            "emp_yoy_pct": 21.7
          }
        ],
        "partial": false
      },
      "county_names": {
        "51107": "Loudoun County",
        "51153": "Prince William County"
      },
      "history": {
        "quarters": [
          "2024-04",
          "2024-07",
          "2024-10",
          "2025-01",
          "2025-04",
          "2025-07",
          "2025-10",
          "2026-01"
        ],
        "emp": [
          37145,
          37589,
          38824,
          38775,
          41440,
          42806,
          43863,
          44761
        ],
        "wage": [
          1591,
          1621,
          1845,
          1728,
          1669,
          1691,
          2027,
          1852
        ],
        "counties": 2,
        "fips": [
          "51107",
          "51153"
        ]
      },
      "sites": 1,
      "mw_disclosed": 0,
      "sites_mw_undisclosed": 1,
      "mw_construction": 0,
      "mw_planned": 0,
      "mw_secured": 0,
      "mw_operating": 0,
      "market_pipeline": {
        "region": "Virginia",
        "label": "Virginia (statewide)",
        "fit": "wider",
        "map_labels": [
          "Ashburn/Sterling",
          "Manassas",
          "Culpeper",
          "Fredericksburg",
          "Richmond",
          "Danville"
        ],
        "region_note": null,
        "mw_uc": 7355,
        "mw_operating": 12338,
        "mw_planned": 39340,
        "page": 8,
        "quote": "H1 2026 KEY INDICATORS* 64 Operators 12,338MW In Operation 7,355MW Under Construction 1.0% Colo Vacancy 39,340M W Planned 1063MW H1 2026 Absorption",
        "null_note": null
      }
    },
    {
      "key": "dfw",
      "name": "Dallas\u2013Fort Worth",
      "state": "TX",
      "iso": "ERCOT",
      "grid": null,
      "utility": "Oncor",
      "note": "Dallas + Tarrant + Ellis",
      "counties_total": 3,
      "counties_used": 3,
      "counties_suppressed": [],
      "as_of": "2026-01-01",
      "base_date": "2025-01-01",
      "yoy_basis": "like_for_like",
      "available": true,
      "thin_base": false,
      "wage": 1845.07,
      "wage_yoy_pct": 5.5,
      "wage_spread_pp": 1.1,
      "emp": 174867,
      "emp_yoy_pct": 1.3,
      "emp_spread_pp": 0.3,
      "wage_cur": 1845.07,
      "emp_cur_total": 174867,
      "counties": [
        {
          "fips": "48113",
          "wage": 1949.0,
          "emp": 104200,
          "wage_yoy_pct": 6.0,
          "emp_yoy_pct": 1.5
        },
        {
          "fips": "48439",
          "wage": 1714.0,
          "emp": 64734,
          "wage_yoy_pct": 4.3,
          "emp_yoy_pct": 0.5
        },
        {
          "fips": "48139",
          "wage": 1450.0,
          "emp": 5933,
          "wage_yoy_pct": 9.1,
          "emp_yoy_pct": 6.7
        }
      ],
      "elec": {
        "as_of": "2026-01-01",
        "base_date": "2025-01-01",
        "available": true,
        "yoy_basis": "like_for_like",
        "wage": 1854.54,
        "wage_yoy_pct": 11.8,
        "wage_spread_pp": 5.1,
        "emp": 22593,
        "emp_yoy_pct": 9.6,
        "emp_spread_pp": 3.2,
        "wage_cur": 1854.54,
        "emp_cur_total": 22593,
        "counties_total": 3,
        "counties_used": 3,
        "counties_suppressed": [],
        "counties": [
          {
            "fips": "48113",
            "wage": 1857.0,
            "emp": 14403,
            "wage_yoy_pct": 11.8,
            "emp_yoy_pct": 7.6
          },
          {
            "fips": "48439",
            "wage": 1896.0,
            "emp": 7471,
            "wage_yoy_pct": 11.7,
            "emp_yoy_pct": 14.2
          },
          {
            "fips": "48139",
            "wage": 1376.0,
            "emp": 719,
            "wage_yoy_pct": 9.5,
            "emp_yoy_pct": 4.4
          }
        ],
        "partial": false
      },
      "county_names": {
        "48113": "Dallas County",
        "48439": "Tarrant County",
        "48139": "Ellis County"
      },
      "history": {
        "quarters": [
          "2024-04",
          "2024-07",
          "2024-10",
          "2025-01",
          "2025-04",
          "2025-07",
          "2025-10",
          "2026-01"
        ],
        "emp": [
          170226,
          171161,
          171787,
          172655,
          176227,
          175139,
          174309,
          174867
        ],
        "wage": [
          1620,
          1637,
          1913,
          1749,
          1695,
          1715,
          2005,
          1845
        ],
        "counties": 3,
        "fips": [
          "48113",
          "48139",
          "48439"
        ]
      },
      "sites": 2,
      "mw_disclosed": 250,
      "sites_mw_undisclosed": 1,
      "mw_construction": 0,
      "mw_planned": 0,
      "mw_secured": 0,
      "mw_operating": 250,
      "market_pipeline": {
        "region": "Dallas + Fort Worth",
        "label": "Dallas + Fort Worth",
        "fit": "close",
        "map_labels": [
          "Red Oak",
          "Fort Worth",
          "Midlothian",
          "Plano/Richardson",
          "Dallas/Irving"
        ],
        "region_note": null,
        "mw_uc": 1720,
        "mw_operating": 1845,
        "mw_planned": 15392,
        "page": 18,
        "quote": "H1 2026 KEY INDICATORS* 45 Operators 1,845MW In Operation 1,720 MW Under Construction 3.4 % Colo Vacancy 15,392MW Planned 124MW H1 2026 Absorption",
        "null_note": null
      }
    },
    {
      "key": "chicago",
      "name": "Chicago",
      "state": "IL",
      "iso": "PJM",
      "grid": null,
      "utility": "ComEd",
      "note": "Cook + DuPage; Elk Grove Village corridor",
      "counties_total": 2,
      "counties_used": 2,
      "counties_suppressed": [],
      "as_of": "2026-01-01",
      "base_date": "2025-01-01",
      "yoy_basis": "like_for_like",
      "available": true,
      "thin_base": false,
      "wage": 2077.67,
      "wage_yoy_pct": 7.5,
      "wage_spread_pp": 3.1,
      "emp": 101266,
      "emp_yoy_pct": 1.8,
      "emp_spread_pp": 0.8,
      "wage_cur": 2077.67,
      "emp_cur_total": 101266,
      "counties": [
        {
          "fips": "17031",
          "wage": 2046.0,
          "emp": 71753,
          "wage_yoy_pct": 7.0,
          "emp_yoy_pct": 0.9
        },
        {
          "fips": "17043",
          "wage": 2154.0,
          "emp": 29513,
          "wage_yoy_pct": 8.7,
          "emp_yoy_pct": 4.0
        }
      ],
      "elec": {
        "as_of": "2026-01-01",
        "base_date": "2025-01-01",
        "available": true,
        "yoy_basis": "like_for_like",
        "wage": 2293.14,
        "wage_yoy_pct": 7.8,
        "wage_spread_pp": 1.1,
        "emp": 12924,
        "emp_yoy_pct": 3.2,
        "emp_spread_pp": -3.2,
        "wage_cur": 2293.14,
        "emp_cur_total": 12924,
        "counties_total": 2,
        "counties_used": 2,
        "counties_suppressed": [],
        "counties": [
          {
            "fips": "17031",
            "wage": 2184.0,
            "emp": 8477,
            "wage_yoy_pct": 7.4,
            "emp_yoy_pct": 0.9
          },
          {
            "fips": "17043",
            "wage": 2500.0,
            "emp": 4447,
            "wage_yoy_pct": 7.8,
            "emp_yoy_pct": 7.8
          }
        ],
        "partial": false
      },
      "county_names": {
        "17031": "Cook County",
        "17043": "DuPage County"
      },
      "history": {
        "quarters": [
          "2024-04",
          "2024-07",
          "2024-10",
          "2025-01",
          "2025-04",
          "2025-07",
          "2025-10",
          "2026-01"
        ],
        "emp": [
          109676,
          109796,
          103085,
          99476,
          110794,
          110540,
          103101,
          101266
        ],
        "wage": [
          1793,
          1809,
          2371,
          1932,
          1881,
          1921,